{
  "schema_version": 1,
  "implementation": "tss-lib",
  "protocol_name": "GG18 (9-round, Paillier)",
  "git_commit": "3f677ff",
  "security": {
    "label": "secp256k1",
    "enc_scheme": "Paillier",
    "enc_modulus_bits": 2048
  },
  "params": {
    "n": 3,
    "t": 1,
    "signers": 2
  },
  "trials": {
    "setup_trials": 3,
    "dkg_trials": 1,
    "sign_trials": 8
  },
  "timing_ms": {
    "setup": {
      "mean": 3259.462944333334,
      "min": 2347.585666,
      "max": 4121.410333,
      "stddev": 725.0210262357956
    },
    "dkg_or_keygen": {
      "mean": 2167.56725,
      "min": 2167.56725,
      "max": 2167.56725,
      "stddev": 0
    },
    "sign": {
      "mean": 161.970125,
      "min": 160.895125,
      "max": 163.50458400000002,
      "stddev": 0.9615588783090749
    },
    "verify": {
      "mean": 0.169390625,
      "min": 0.167541,
      "max": 0.175625,
      "stddev": 0.0025518880724622324
    }
  },
  "throughput_sig_per_sec": 6.1739780715733845,
  "bandwidth_bytes": {
    "total": 21414,
    "per_party": 10707,
    "per_round": [
      {
        "round_label": "round6",
        "bytes": 958,
        "exactness": "exact"
      },
      {
        "round_label": "round7",
        "bytes": 208,
        "exactness": "exact"
      },
      {
        "round_label": "round1",
        "bytes": 4874,
        "exactness": "exact"
      },
      {
        "round_label": "round3",
        "bytes": 208,
        "exactness": "exact"
      },
      {
        "round_label": "round4",
        "bytes": 550,
        "exactness": "exact"
      },
      {
        "round_label": "round5",
        "bytes": 208,
        "exactness": "exact"
      },
      {
        "round_label": "round8",
        "bytes": 482,
        "exactness": "exact"
      },
      {
        "round_label": "round9",
        "bytes": 208,
        "exactness": "exact"
      },
      {
        "round_label": "round2",
        "bytes": 13718,
        "exactness": "exact"
      }
    ],
    "per_round_comparable_across_impl": false
  },
  "object_sizes_bytes": {
    "signature": 64,
    "ec_public_key": 33,
    "ec_key_share": 32,
    "enc_public_key": 256,
    "enc_key_share": 256,
    "enc_ciphertext": 512
  },
  "correctness": {
    "all_signatures_valid": true
  },
  "environment": {
    "os": "darwin",
    "impl_language": "go1.25"
  },
  "notes": ""
}
