{
  "schema_version": 1,
  "implementation": "tr-ecdsa",
  "protocol_name": "TR-ECDSA (3-round, CL-HSM)",
  "git_commit": "76ca73f",
  "security": {
    "label": "112",
    "enc_scheme": "CL_HSMqk",
    "enc_modulus_bits": null
  },
  "params": { "n": 5, "t": 4, "signers": 5 },
  "trials": { "setup_trials": 2, "dkg_trials": 2, "sign_trials": 8 },
  "timing_ms": {
    "setup": { "mean": 136.433042, "min": 136.262333, "max": 136.60375, "stddev": 0.1707085 },
    "dkg_or_keygen": { "mean": 50.4027505, "min": 49.736209, "max": 51.069292, "stddev": 0.6665415 },
    "sign": { "mean": 3143.8126, "min": 3127.77283, "max": 3175.62646, "stddev": 15.0200769 },
    "verify": { "mean": 0.303765625, "min": 0.300167, "max": 0.317833, "stddev": 0.00555181628 }
  },
  "throughput_sig_per_sec": 0.318085117,
  "bandwidth_bytes": {
    "total": 23292,
    "per_party": 4658.4,
    "per_round": [
      { "round_label": "round1", "bytes": 3760, "exactness": "upper_bound_estimate" },
      { "round_label": "round2", "bytes": 11288, "exactness": "exact" },
      { "round_label": "round3", "bytes": 8244, "exactness": "exact" }
    ],
    "per_round_comparable_across_impl": false
  },
  "object_sizes_bytes": {
    "signature": 56,
    "ec_public_key": 29,
    "ec_key_share": 28,
    "enc_public_key": 224,
    "enc_key_share": 75,
    "enc_ciphertext": 449
  },
  "correctness": { "all_signatures_valid": true },
  "environment": { "os": "darwin", "impl_language": "cpp17" },
  "notes": ""
}
